ID,Reviewer,Rating,Review Time,Review Content,Owner Response
75,Quentin Auvray (golbarg),5,2016-07-08,"Wow. If you want to listen to and discover music, find any kind of book or even just have an awesome elevator ride, go to BAnQ! The building is impressive. Grab two pieces of ID and get your library card done ASAP! You can get books put aside online. Many great cultural events also take place here, be sure not to miss them.",None
76,Discovering Destinations,5,2017-07-08,"Where: BAnQ Grande Bibliothèque - Montreal, Quebec
What: A huge central library
How was it:  We are lucky because this place is very close to home.  It's so close that we'll go for long periods at a time without going or even forgetting it's there.
One of the perks of living on the island - you don't need to pay for the membership.  They have lots that you can check out online, even reading material, renew your almost due books with a simple click or even rent music or movies.  It's huge, well decorated and clean.  We'll even come to study here sometimes.
Grade: Eli = 5, Serge = 4+
Recommend: Yes, if you're in the area and you like libraries.  Best case scenario you can even get your membership !",None
77,L B,4,2016-07-08,"Aside from the few rude security guards and few aggressive people, it THE library for everyone to go and have a good time reading, listening to music and watching movies. I've been a member since 2012 and I only go there now for my book borrowing. At first I wasn't sure if it was expensive to join or if I had to live downtown in order to join, once learning that they except anyone regardless of municipal heresay I was overjoyed and surprised. So many items and they keep improving and adding more features and services each and every year to make the members more happier. They sell items during the Summer outside til Fall and have the once-a-season merchandising sale. Its truly one of the best places ever built in this city and am very thankful and  happy it exist.",None
78,Carma Daria Companiona,5,2018-07-08,"This is a huge huge place. 5 floors of tons of resources. If you can't find something to read, watch, listen to, or play here that you would like, then there's little hope. The architecture of this building is especially impressive. Open staircase. Three glass elevators that allow you to see your voyage up or downstairs. I'll definitely be returning!",None
79,Carlos Denner,5,2023-04-08,First class library with lots of activities for kids,None
80,Qiot Riot,5,2018-07-08,Awesome public library.  Wish ours back home was like this.  Lots of programming for kids and families. quiet areas to just sit and rest. Relatively clean but the bathrooms get used by anyone off the streets. Wish we had more time to explore this place.,None
81,Simon S,5,2018-07-08,"A beautiful building with a knowledgeable heart inside :) a great place to visit and granb a book, movie or listen to music",None
82,Sam “montrealsam” Totah,5,2020-07-07,Excellent!  Huge place. Friendly personnel! A great many subjects. You need several visits to get to know. Some sectors full of students. Public stay on the ground floor. Children section is paradise. Music and video section for the connaisseur. The only missing point there is no personnel to help you if your computer fails. You are on your own. Limited print section. Besides books there are activities such as lectures. First come or reservation. Strongly suggest you visit to feel at home! February 2020 still 1 of the best spots in Montreal! Visit & re-visit at your leisure!,None
83,Raehyun Han,3,2019-07-08,"I have really loved this library. I used to go there every weekend with my kids. But I was bitten 7 shots on my arms and legs by bed bugs yesterday while I was reading books. I think library should be closed for a while, or just don't go there. If you must go there, please don't sit on chairs. You will surely know what I am saying.",None
84,Louigi Addario-Berry,5,2019-07-08,"I really like this place architecturally. Checking out books is super smooth and the book return conveyer belt is awesome. Too bad that multimedia loans have to be returned back to the BanQ rather than to other Montreal library branches - it would be a big plus if that could be changed. Bustling place, friendly staff. Keep up the good work.",None
85,Kara Thrace,5,2013-07-09,"One of the biggest libraries I've ever seen. High ceilings and hard-wood floors, this is a work of art. They have all sorts of different sections, including one on Japanese books. I spent a few hours going up and down the shelves and looking at art. Those massive windows give this place a clean, calm feel. Definitely will be stopping back when I'm in town again.",None
86,Alexander Peplowski,5,2022-07-07,"An amazing resource for Montrealers. Lends out physical and digital copies of both English and French books, guides, textbooks, comic books, video games, movies, journals, magazines. Also has desktop computers stations for personal use, study spaces, conference rooms and printing services.",None
87,Cynthia Mah,5,2021-07-07,"Been coming here for years and it never disappoints! More than just books: DVDs, video games, comics, manga, and music. Accessible from the metro level too, which is a godsend in the winter.",None
88,Marieve Lacelle,4,2018-07-08,"Very clean and bright library with a lot of options from books, sc.research, ebooks and DVD/blue ray. Great coffee and service. However don’t take a nap in your study breaks, napping is not allowed even if you have been studying for long hours",None
89,daniel lucia,4,2021-07-07,"I’ve been coming to this place for 3 years now to do homework, job applications even to create a to do list. It doesn’t even feel like I’m at a traditional library. However, you are downtown so it’s distracting for me to get things done and it does take some motivation.",None
90,Tessa Blanc,5,2018-07-08,"This is where you go when you need to escape Life and wish to get lost in Thought and Imagination.  Beautiful setting for a library (4 floors of books, music, and videos) and competent staff members.  A perfect getaway on a rainy afternoon.",None
91,Maey,5,2021-07-07,"This is a massive sprawling library with options in french, english, and to a lesser extent, other languages such as german and spanish. The staff are kind and patient. They don't speak much english (this is a french part of town, after all, with its closeness to UQAM) I have spent hours perusing the isles and reading. Its a marvel. Its what all libraries should be. And their top floor!!! Filled with movies, CD's, video games. THEY EVEN HAVE RECORDS!!!! And record players. They have music production studios you can RENT OUT! The bottom floor is the childrens area, filled with color and life. It's clean, with a beautiful modern design, without feeling cold or unwelcoming.",None
92,Jamal Abdallah,4,2019-07-08,Great library! It literally has everything you can ask for,None
93,Sun Yueru,5,2021-07-07,"The library and the staff went above and beyond in keeping the services accessible during the pandemic. They are incredibly responsive to general inquiries, and fast to adjust to COVID-specific restrictions, e.g. contactless pick-up. Kudos for keeping the library open and running!",None
94,P.H Henry,5,2018-07-08,"Amazing place for studying and quietness. Maybe one of the fastest internet you can find in the city  from over 250 to 300 mbps speed. I suggest you to come very early at 10 AM to get the best spots possible because it's get very crowded from 12 PM to 19 PM. The staffs very are friendly. You don't need to bring a book to stay here, just don't get caught sleeping by the security guards because it's quite embarrassing.

The only downfalls are the lack english books (for the english speaker)  ,it's closed on Monday and a lot of homeless people.",None
95,Mehran Islam,5,2023-03-09,One of the best libraries in MTL ever!!!,None
96,Aur D,5,2021-07-07,"Nice and empty, you should take your time if drive a car, not a lot of  parking places near ( i didnt use their parking, no idea what to expect ).  Paper books seems to become a taboo now ...  you can not wash a book, no ?  😆 …",None
97,John Holmes,2,2018-07-08,"nice collection, but mercenary approach to collecting 'overdue' fines, as many ( mostly donated?) films inexplicably seem to be  'reserved' upon attempting online renewal, with big fines ..they brazenly block last minute online renewals by removing the 'mon dossier' option from the page....they are greedy for fine revenue, &  you have to ask them after to remove unfair fines...many smug, bureaucratic employees.  Warning: It is best not to visit the bathrooms ( especially those outside the ground floor 'sensor' area) as the guards will follow patrons ( men OR women)  inside, and wait directly outside the stall while the patron performs their 'business'....this is 'normal' guard behavior, according to a library receptionist. It seems voyeuristic, if not a breach of privacy, to me.",None
98,Kathy Nga Ting Ho,5,2017-07-08,"There is plenty of space to sit!! You know how hard it is to find a spot to read in a library in Toronto and in universities and in coffee shops. Well at BANQ, this is not an issue.

It is a fantastic library, I'm so glad it lives.

You need to be a member to use WiFI and check out a book. If you live in Montreal, your membership is free. Their website explains what documents you need.",None
99,Francois-Xavier,5,2016-07-08,"Great place to study! Free membership for resident of the Montreal Island. Free Wifi, Free outlets, print or photocopy (0,15$ per pages). It is also possible to use one of the many workstation available.

Also possible to use the meeting rooms for free for your study groups (up to 12 seats), just need to reserve the room.",None
100,Abderrahmane Djerourou,5,2022-07-07,A very good library. Workers are nice and helpful. I love working there.,None
101,Imran Chowdhury,5,2021-07-07,I don't think I have anything to add about this place it's as everyone said about it.It is a beautiful and fantastic library i don't think I have ever seen such a gigantic library before in my life.if you go in the alleyway right beside the library you'll find two small bookstores.which has diverse books of diferent languages.,None
102,Steven Bjerke,5,2020-07-07,"Vast selection of books, newspapers and documents spread out over many floors. Cheap photocopiers and good internet access too. After 7 can get sketchy with a lot of drug users and homeless in the area.",None
103,John O'Meara,4,2022-07-07,"Selection is good and hours are decent. English library is limited and being closed on Monday is a little annoying, but it's fine otherwise",None
104,Amir,5,2021-07-07,"Best library that I've ever seen and experienced. Unlimited resources,  books, music, games etc. Amazing service, friendly staff. Love their online service.",None
105,JJ Junio,5,2016-07-08,"I love our public library system and BAnQ is its crown jewel. There are a lot of desks available for everyone on regular days, although you might find yourself looking for a spot when exam week is upon us.

You can borrow books, dvds, audio cds, games and use their wi-fi if you have a BAnQ borrower's card which you can easily get if you have a driver's license or other proof of residency documents. They also do have the kids space at the basement where kids could watch movies and read children's books and play games. You could definitely spend a day easily here if you are a book lover! I love this place!",None
106,Ricardo Fernandez,3,2017-07-08,"The good: This place is really great to study they have a lot of resources and reading material. They have desks, comfortable seating places and even space for watching movies in the 4th floor. Located in the downtown area there are plenty of cafes and restaurants around.

The bad: Their costumer service is very unprofessional and easy to snap at you with rude remarks. I was inquiring for printing and photocopies and the clerk laughed at me saying they were not a printing house. I didnt understand why they were charging a few fees for late return and upon asking I met with staff that gave me attitude. I paid the fees since I did bring the material late yet dealing woth their costumer service was not a pleasure. Lastly on this note they really dont have a lot of english material, they have more french which is okay for me.

The ugly: lots of homeless people or people that seem to be anyway. Watch out for your stuff.",None
107,Jack Reid,5,2022-09-10,Excellent and clean location. Great selection of periodicals. Enjoyed studying the lsat here,None
108,prs,3,2018-07-08,"Please Please, Please consider this comment. I really like this place, but I will take 2 stars off to get your attention guys..... who ever reads this comment PLEASE , PLEASE, PLEASE extend the hours. Saturdays, Sundays and please include Mondays too..... please please please. We need to study 7 days a week. Montreal is getting crowded, we need more on the hours ; and these days everybody has a laptop. Some of the tables don’t have an electricity plug. Please consider.",None
109,Josh Le,5,2016-07-08,"All residents of Montreal get a library card! You just need two pieces of ID with your address on one of them. The building is very beautifully constructed, but the magic is inside with access to endless amounts of information. There's access to the library from the Berri-UQAM metro station, so you don't have to brave the elements to feed your mind. Happy learning!",Thanks/Merci!
110,Alex Su,1,2021-07-07,"It was negative 15 outside and my friend was late to pick me up, so I thought it would be acceptable to wait here until he finds his way around Montreal. (I am a university student from Ontario and not familiar with the area). I was quiet, and standing on a corner with no one around me. The security guard approached me and insisted that I have to leave without giving any reason and forced me to stand in the cold for 10 minutes.","Hi! Thank you for sharing this with us. We value your comment and would like to respond properly. May we ask you to submit your comment in our online form (https://www.banq.qc.ca/formulaires/commentaires/index.html?language_id=1)? Please specify when this happened (day and hour) and in which part of the library. It may seem like a hassle, but we assure you that it is the best way to get to the bottom of what happened. We’ll then be able to directly follow up with you."
111,Gab Lauzon,5,2018-07-08,"My favorite place in the world. They have basically everything you could want in terms of books, tons of videogames and lots of movies and series. It's easy to find a quiet spot you can spend the entire day in.",None
112,Jian Yi Zhang,5,2021-07-07,"I had to resubscribe recently and was happy to learn that any administrative fees such as to replace a card had been waved due to the pandemic. Reservations, which I've done a handful, take a minimum of 2 (open) days to process. If you reserve items on Friday, expect to pick it up only by Monday at the earliest. A minor inconvenience.",None
113,Lucia Taddeo,5,2023-05-08,Wonderful library with a vast selection of books from different categories in different languages. Large reference center. Computers available for individual use.,None
114,Kamel El-Fashny,5,2022-07-07,This is a huge library with so much to offer to the public. I like that it has an indoor parking and the staff is very helpful.,None
115,James Gz,1,2017-07-08,Got fleas and Bed Bugs. This used to be my favorite place to visit. Now its over run with homeless people. They bring fleas & bedsbugs with them while siting on the comfy chairs. I got 20 bites in the 10 minutes I sat there.,None
116,Jason Behrmann,4,2016-07-08,Impressive collection of literature and audio in many languages. I used to rent Electronica cds here almost every day.  The  problem with the place is that it is often crowded with less desirable people. It is difficult to find a good workspace.,Thanks/Merci!
117,Mehari Teklu abraha,5,2022-07-07,I go usually to bibliotheque to read books listen some music and watch films and I pass my day here enjoying myself.it is my prefered place,None
118,Rita Li,5,2012-07-09,A nice place to study and to pass time. Every Qubecoise could subscribe here for free and can borrow up to 15 documents or films for one time. Plenty of lounge and spacious tables. Free Wifi access using subscribe card number and password.,None
119,Aubrey Backscheider,5,2014-07-09,One of my favorite libraries in Montreal. There are enough volumes in English to still be a worthwhile trip to non-french speakers. Check out the vinyl record collection on the top floor. Amazing!,None
120,Sô Eau,5,2022-07-07,"Love this library, so beautiful and big, you can find anything you want ! People are really nice too.",None
121,Henry Yu,5,2017-07-08,"I love this library, fast wifi, lots of archives, good books to borrow or read and many floors and desks for studying. Absolutely well kept and great resource for all Montreal denizens.",None
122,Karthik Rao,5,2017-07-08,I loved the virtual reality show here. It was in French and I couldn't understand but just the experience with the  VR device was good. The library has a huge selection of books.,None
123,Joseph Bonnani,3,2021-07-07,Many of the documents are damaged (such as DVD's and Blu-Ray videos)  yet they keep being available; that is a waste of time for users who go to the library and go through the entire process of loaning a video just to find out it cannot be viewed at home because it is damaged.,"Hi! Bibliothèque et Archives nationales du Québec (BAnQ) makes sure the audiovisual collection is regularly and properly maintained. We repair faulty discs by polishing the reading surface. This type of damage can occur occasionally because of the high circulation that this collection is subjected to and the difference in the reading quality of home devices. If you encounter a problem with one of our CD or DVD, you can alert us by inserting a little note about the problem in the case or the flap when you return the item. You can also bring the item to one of our staff member at the service counter on the main floor of the Grande Bibliothèque. We will then determine if a cleaning or polishing is required. If the disc is too badly damaged, we will try to replace it."
124,Dmytro Kuznetsov,5,2021-07-07,"I love this library. It's centrally located; the selection if loanable material is impressive, and returns can be made to any city library in Montreal.",None
125,Heather Cheung,5,2018-07-08,Beautiful library!! All kinds of unique study places. Very clean with a cafe as well. I love the sculpture outside.,None
126,Sylvia Pianista,5,2020-07-07,"I think it's a good tourist attraction for people to visit but you got to be quiet,  and it's also  a great place for professionals to do some work.There's a separate basement for kids with cushions and stuff to do.",None
127,Jeff Jeffcoat,5,2023-01-08,"Good selection
Staff is able and helpful and no more covid-19 restrictions. Lots of new documents available..... 😉 …",None
128,B Cadorette,5,2020-07-07,"Great place, has everything, books DVDs CDs video games, good wifi, 2 hours computer time per day. Places to watch dvds, listen to LPs, practice keyboards, play social games. Probably lots more.",None
129,Josh Owen,1,2018-07-08,"DISHONEST underground parking fees.  First, they don't mention anywhere the cost.  Secondly, you have to put a minimum of $2. Finally, you can only buy time in blocs of 30 minutes. Here's how it works:  if you want to stay 30 minutes, put $2.  If you want to stay 60 minutes, put $4.  ATTENTION: if you put $3, it will only give you time for $2 and the machine will eat your extra $1 without any chance to get it back.  So if you put $3 you will get time for $2.  If you put $5 you will get time for only $4 !  The machine won't return your extra dollar and won't give you time for it.",None
130,Lorena,5,2022-07-07,"I used to go to this library during final exam season. It is quiet, clean, and the staff was always professional and prompt to assist",None
131,Jack Caldwell,5,2022-07-07,"I absolutely adore the Grande Bibliothèque in the great city of Montréal! I'm always down to go there, and I do once or twice a week.😀 …",None
132,Lupa Duende,5,2020-07-07,"The children's section is replete with manga, to the delight of my boys. The staff are courteous, informed, and helpful. A good place to recharge with friendly books.",None
133,Hamed Mohammadi,5,2023-05-08,Fine collection of books and gmaes.,None
134,Leslie Proulx,4,2016-07-08,"Such a good place to get so many books that aren't readily available at other libraries. Helpful and courteous staff who knowledgeable and friendly, week maintained inventory and ease of access all help make this library a Montreal gem!",None
135,Victoire K,5,2020-07-07,"Great place to study! go there in the morning as the spots fill in pretty fast! Access direct from the metro, so you dont even need to go outside",None
136,Trevor Kinkade,5,2020-07-07,We loved the youth hockey exhibit last Summer. The older gentleman running the exhibit was fantastic - chatted with us for 15 minutes about his personal history with hockey in Montreal.,None
137,Connie Dominguez,5,2022-07-07,This library continues to offer outstanding service...even during these difficult times. I was happy to find it open and well-controlled.,None
138,Tania C,5,2018-07-08,"I absolutely love this library, it’s my favourite  place to study and relax by reading a book. It’s so cozy, great selection of books in any language you want !!!",None
139,Lucy Wang,5,2021-07-07,They have a great collection of titles and have many study areas ☺️ it’s my go-to public library!,None
140,James Roche,5,2017-07-08,Simply superb place. Well-designed and a nice integration of robotics --it always a joy to go there. Not to mention the truly fantastic selection of books.,None
141,Антоша,4,2019-07-08,"I love, love, love, love the library, but this recent bedbug scare got me. Therefore only 4 stars. Its a shame though, a big shame, because it's one of my favorite spots in the city.",None
142,Dwain Richardson,4,2021-07-07,"It is possible to borrow books and CDs in a wide array of subjects. DVDs may also be borrowed.

Just disappointed that the library staff removed all seating areas, but I suspect this measure is temporary.",None
143,Fernanda Nicoli,5,2019-07-08,"This place is just amazing. Every book I can think of I can find in here. Great collection of art and architecture books. They also carry a lot HQs, CDs, DVDs.",None
144,kunal rakshit,5,2019-07-08,Great ambience for studying. They also provide you with iPad and laptops if you want to use them inside the library.,None
145,Chris Stefanou,4,2022-12-09,"Everything you need and want
Me.    Comic books 💯👀👍!!!!!!! …",None
146,Carlo Vasniyan,5,2022-07-07,"Big Thanks to Felix, I forgot about my permit 1 day before my wedding. He send it to me in 1 hour.",None
147,Ganonymous Last,4,2016-07-08,Impressive. Free audio self guided tours. Impressive in that it has more resources than  anything I've seen around Canada in a library. Montreal residents should be grateful to have it. Worth the stop to see what's there.,None
148,Benoît Eclache,5,2016-07-08,"Love it. Great place to work, study, relax, learn something new, etc. The staff is really helpful and can help anyone find what they are looking for. There is also a lot of seats and the WiFi works pretty well.",None
149,Jennifer C,5,2020-07-07,"If this is the same BanQ where one can order archival records from the 1800s, your representative, Chloe R., is incredibly helpful, pleasant, and efficient.  I live in Florida, and she has helped me a couple times so far.  Thank you so very much!",None
150,Fas,5,2023-03-09,Great spot very quiet 👍🏻 …,None
151,Eran Goldstein,5,2021-07-07,"Amazing library, so many comic books video games, Novells movies board games, and actually EVERYTHING!",None
152,Alissa Osumi,5,2019-07-08,Best place to study or work. It could be busy sometimes. There’s a huge selection of books and movies.,None
153,Me,4,2019-07-08,"Great library. There's a variety of books, dvd's, and cd's. Not the ideal place to study or do work.",None
154,pilot kayayan,5,2019-07-08,Best library to study in Montreal! The only sad side is that it’s closed on MONDAYS 🙃 We need to study as much as possible. Please!! …,None
155,令狐冲,4,2014-07-09,"pretty good library, resources are huge, and facilities are good.but the language is restricted, announcement is French, infos board js French, thx that reception staffs could speak English.",None
156,Nusrat Jahan Neetu,5,2022-07-07,A wide variety of books. Stuffs are really helpful. Liked the reading arrangement too. Highly recommended.,None
157,Jesper Bexkens,2,2017-07-08,Poor services if you are not a member while they do have the facilities to accommodate. On service level they could learn from the Halifax library.,None
158,Olinto Mendez,5,2020-07-07,"It is the paradise for readers and researchers, the infrastructure is modern, spacious and beautiful, the collection of works is impressive and the service is of quality.  a real treasure in montreal.",None
159,Maxime P. Hébert,5,2016-07-08,"As long as you are a Quebecker's resident , you can get a free Library pass to rent books ! The most complete library you will evet get !!",None
160,Youssef Elmokadem,5,2020-07-07,"Libraries are places of refuge for many, and this one is no different.

Magnificent library, worth the visit even for visitors.",None
161,Simone Samuels,5,2017-07-08,"Great, clean, renovated, QUIET place to read and study.  Good book offerings in both English and French.  I love the BAnQ!",None
162,Gaby Zonana,5,2022-07-07,"Well maintained,  clean , would definitely recommend as working spaces for students",None
